"Reddit Link";"News Link";"date_utc";"timestamp";"title";"text";"subreddit";"comments"
"https://www.reddit.com/r/unitedkingdom/comments/vkhdxn/what_have_we_done_six_years_on_uk_counts_the_cost/";"https://www.theguardian.com/politics/2022/jun/25/what-have-we-done-six-years-on-uk-counts-the-cost-of-brexit";2022-06-25;1656170737;"What have we done?: six years on, UK counts the cost of Brexit";"";"unitedkingdom";600
"https://www.reddit.com/r/unitedkingdom/comments/qjksia/brexit_is_harming_the_uk_economy_say_44_of_voters/";"https://www.theguardian.com/politics/2021/oct/30/brexit-is-harming-the-uk-economy-say-44-of-voters";2021-10-31;1635666803;"Brexit is harming the UK economy, say 44% of voters";"";"unitedkingdom";412
"https://www.reddit.com/r/unitedkingdom/comments/a4tsck/uk_can_cancel_brexit_by_unilaterally_revoking/";"https://www.independent.co.uk/news/uk/politics/brexit-court-case-ecj-ruling-article-50-theresa-may-deal-uk-european-court-justice-latest-a8675541.html";2018-12-10;1544429361;"UK can cancel Brexit by unilaterally revoking Article 50, European Court of Justice rules";"";"unitedkingdom";504
"https://www.reddit.com/r/unitedkingdom/comments/f3qfsq/brexiteer_complains_he_has_to_wait_in_queue_at_eu/";"https://www.independent.co.uk/news/uk/home-news/brexit-eu-airport-queue-immigration-brexiteer-amsterdam-airport-schiphol-a9335281.html?utm_medium=Social&utm_source=Facebook#Echobox=1581675654";2020-02-14;1581676682;"Brexiteer complains he has to wait in queue at EU airport";"";"unitedkingdom";743
"https://www.reddit.com/r/unitedkingdom/comments/920kcz/brexit_not_too_late_for_uk_to_change_its_mind_and/";"https://www.theguardian.com/politics/blog/live/2018/jul/26/brexit-not-too-late-for-uk-to-change-its-mind-and-stay-in-eu-on-same-terms-says-french-minister-politics-live";2018-07-26;1532594859;"Brexit: Not too late for UK to change its mind and stay in EU on same terms, says French minister - Politics live | Politics";"";"unitedkingdom";474
"https://www.reddit.com/r/unitedkingdom/comments/dwo93f/uk_prime_minister_withholding_report_on_russias/";"https://www.msnbc.com/rachel-maddow/watch/uk-prime-minister-withholding-report-on-russia-s-role-in-brexit-72912453798";2019-11-15;1573809134;"UK prime minister withholding report on Russia's role in Brexit - Rachel Maddow";"";"unitedkingdom";192
"https://www.reddit.com/r/unitedkingdom/comments/9hfual/emmanuel_macron_calls_brexit_campaign_leaders/";"https://www.independent.co.uk/news/uk/politics/brexit-talks-latest-eu-emmanuel-macron-brexiteer-liars-no-deal-a8547146.html?";2018-09-20;1537454356;"Emmanuel Macron calls Brexit campaign leaders 'liars', in extraordinary attack";"";"unitedkingdom";412
"https://www.reddit.com/r/unitedkingdom/comments/j909bj/brexit_anger_as_ministers_use_obscure_rule_to/";"https://www.independent.co.uk/news/uk/politics/brexit-chlorinated-chicken-eu-mps-boris-johnson-b914047.html";2020-10-11;1602396811;"Brexit: Anger as ministers use obscure rule to deny MPs a vote on blocking chlorinated chicken imports";"";"unitedkingdom";488
"https://www.reddit.com/r/unitedkingdom/comments/8nh8vk/anger_among_brits_in_france_after_brexit_champion/";"https://www.thelocal.fr/20180531/anger-among-brits-in-france-after-brexit-campaigner-applies-for-residency";2018-05-31;1527761552;"Anger among Brits in France after Brexit champion applies for residency. The news that Lord Lawson, a long-time British immigrant in France and leading Brexit campaigner has applied for a carte de séjour residency permit has provoked anger among UK residents on this side of the channel.";"";"unitedkingdom";316
"https://www.reddit.com/r/unitedkingdom/comments/9047rq/why_is_britain_turning_blind_eye_to_leave_sides/";"https://www.irishtimes.com/opinion/why-is-britain-turning-blind-eye-to-leave-side-s-lawbreaking-1.3568256";2018-07-19;1531990908;"Why is Britain turning blind eye to Leave sides lawbreaking? Illegal fund activity linked to Brexit being ignored in belief the people have spoken.";"";"unitedkingdom";342
