"Reddit Link";"News Link";"date_utc";"timestamp";"title";"text";"subreddit";"comments"
"https://www.reddit.com/r/unitedkingdom/comments/kkq7a4/its_time_to_leave_the_word_brexit_behind_and_hold/";"https://www.independent.co.uk/voices/letters/brexit-deal-eu-boris-johnson-trade-b1779091.html";2020-12-26;1609017659;"Its time to leave the word Brexit behind and hold the government accountable for what it delivers now";"";"unitedkingdom";316
"https://www.reddit.com/r/unitedkingdom/comments/8q7jae/70_of_young_scots_believe_brexit_vote_was_a_bad/";"https://www.glasgowlive.co.uk/news/glasgow-news/70-young-scots-believe-brexit-14767630";2018-06-11;1528700717;"70% of young Scots believe Brexit vote was a 'bad result'";"";"unitedkingdom";448
"https://www.reddit.com/r/unitedkingdom/comments/bd0nhg/judge_orders_ukip_to_reveal_brexit_referendum/";"https://www.theguardian.com/politics/2019/apr/14/judge-orders-ukip-reveal-brexit-referendum-data-use";2019-04-14;1555229316;"Judge orders Ukip to reveal Brexit referendum data use";"";"unitedkingdom";83
"https://www.reddit.com/r/unitedkingdom/comments/dkovvn/new_postbrexit_tv_show_a_place_in_the_shit_a/";"https://simpleflying.com/uk-airports-100ml-rule-removal-guide/";2019-10-20;1571601476;"New Post-Brexit TV Show - ""A Place in the Shit"" - A daytime show where sunburnt pensioners forced home from Spain look around grotty UK flats with faces like thunder.";"Got to be worth the BBC license fee on it's own surely?  

&amp;#x200B;

Dom Joly on Twitter

 https://twitter.com/domjoly/status/1185857829921533955?s=20";"unitedkingdom";238
"https://www.reddit.com/r/unitedkingdom/comments/brqxz2/nigel_farage_stuck_on_brexit_bus_due_to_people/";"https://www.mirror.co.uk/news/uk-news/breaking-nigel-farage-stuck-brexit-16185168";2019-05-22;1558542870;"Nigel Farage 'stuck on Brexit bus due to people armed with milkshakes'";"";"unitedkingdom";515
"https://www.reddit.com/r/unitedkingdom/comments/kn5nue/brexit_theresa_may_tells_mps_that_her_deal_was/";"https://www.independent.co.uk/news/uk/politics/brexit-theresa-may-boris-johnson-trade-deal-b1780329.html";2020-12-30;1609346718;"Brexit: Theresa May tells MPs that her deal was better than Boris Johnsons";"";"unitedkingdom";419
"https://www.reddit.com/r/unitedkingdom/comments/em7etu/unforgivable_uproar_after_erasmus_scheme_scrapped/";"https://scramnews.com/unforgivable-uproar-after-erasmus-scheme-scrapped-in-brexit-vote/";2020-01-09;1578562594;"""Unforgivable"": Uproar after Erasmus scheme scrapped in Brexit vote";"";"unitedkingdom";580
"https://www.reddit.com/r/unitedkingdom/comments/5yemgp/theresa_may_hailed_a_baking_company_as_proof_that/";"https://www.ft.com/content/e4b63df0-77fa-38f3-a613-4be4b86ec91f";2017-03-09;1489060256;"Theresa May hailed a baking company as proof that showed how Brexit could be a piece of cake. Its just been bought by a French rival company, MD says it was ""decimated"" due to prospect of leaving EU";"";"unitedkingdom";210
"https://www.reddit.com/r/unitedkingdom/comments/9rknpo/alan_sugar_says_boris_johnson_and_michael_gove/";"https://www.independent.co.uk/news/uk/politics/brexit-alan-sugar-boris-johnson-michael-gove-imprisoned-lies-350m-nhs-vote-leave-apprentice-a8601891.html";2018-10-26;1540559996;"Alan Sugar says Boris Johnson and Michael Gove should be imprisoned over Brexit 'lies' - The Apprentice host suggests 2016 referendum result should be declared 'void'";"";"unitedkingdom";169
"https://www.reddit.com/r/unitedkingdom/comments/blqlv0/a_world_first_boris_johnson_to_face_private/";"https://m.independent.ie/world-news/europe/britain/a-world-first-boris-johnson-to-face-private-prosecution-over-brexit-campaign-claims-38087479.html";2019-05-07;1557235120;"'A world first' - Boris Johnson to face private prosecution over Brexit campaign claims";"";"unitedkingdom";165
"https://www.reddit.com/r/unitedkingdom/comments/bcrv28/uk_parliament_very_likely_to_consider_new_brexit/";"https://www.cnbc.com/2019/04/13/uk-parliament-very-likely-to-consider-new-brexit-referendum-says-british-finance-minister.html";2019-04-13;1555170594;"UK parliament 'very likely' to consider new Brexit referendum, says British finance minister";"";"unitedkingdom";210
"https://www.reddit.com/r/unitedkingdom/comments/afd6x5/more_than_100_meps_from_every_corner_of_eu_sign/";"https://www.independent.co.uk/news/uk/politics/brexit-meps-european-parliament-final-say-peoples-vote-second-referendum-a8723066.html";2019-01-12;1547336205;"More than 100 MEPs from every corner of EU sign heartfelt letter asking British people to reconsider Brexit";"";"unitedkingdom";301
"https://www.reddit.com/r/unitedkingdom/comments/a64gwj/the_scottish_tories_are_preparing_to_back_a/";"https://www.newstatesman.com/politics/staggers/2018/12/scottish-tories-are-preparing-back-second-brexit-referendum";2018-12-14;1544791211;"The Scottish Tories are preparing to back a second Brexit referendum";"";"unitedkingdom";169
"https://www.reddit.com/r/unitedkingdom/comments/8mxbip/nick_clegg_brexiteers_are_right_to_panic_theyve/";"https://inews.co.uk/opinion/columnists/nick-clegg-the-brexiteers-are-right-to-panic/";2018-05-29;1527580193;"Nick Clegg: Brexiteers are right to panic  theyve failed to deliver utopia and are almost out of excuses";"";"unitedkingdom";533
"https://www.reddit.com/r/unitedkingdom/comments/arjeb8/brexit_billboard_crusaders_four_working_dads_are/";"https://www.euronews.com/2019/02/17/brexit-billboard-crusaders-four-working-dads-are-holding-politicians-to-account";2019-02-17;1550399147;"Brexit billboard crusaders: Four 'working dads' are holding politicians to account";"";"unitedkingdom";212
"https://www.reddit.com/r/unitedkingdom/comments/86ur39/brexit_campaign_was_totally_illegal_claims/";"https://www.channel4.com/news/brexit-campaign-was-totally-illegal-claims-whistleblower";2018-03-24;1521914600;"Brexit campaign was totally illegal, claims whistleblower - Channel 4 News";"";"unitedkingdom";317
"https://www.reddit.com/r/unitedkingdom/comments/bm595a/eu_officials_privately_branded_theresa_mays/";"https://www.independent.co.uk/news/uk/politics/brexit-theresa-may-eu-bbc-documentary-behind-closed-doors-barnier-verhofstadt-a8904156.html";2019-05-08;1557321978;"EU officials privately branded Theresa May's Brexit strategy 'insane' and 'pathetic', film reveals : 'What the f*** is wrong with her', a concerned official said on camera";"";"unitedkingdom";220
"https://www.reddit.com/r/unitedkingdom/comments/9q20et/no_significant_arrests_made_after_600000_attend/";"https://www.standard.co.uk/news/london/no-significant-arrests-made-after-thousands-attend-people-s-vote-march-a3967256.html";2018-10-21;1540110574;"No significant arrests made after 600,000 attend Peoples Vote march on second Brexit referendum";"";"unitedkingdom";296
"https://www.reddit.com/r/unitedkingdom/comments/61r06c/the_uk_was_due_to_take_over_the_eu_presidency_on/";"https://www.ft.com/content/9dfa35aa-4e5b-11e6-8172-e39ecd3b86fc";2017-03-27;1490603968;"The UK was due to take over the EU presidency on 1 July (an opportunity to lead European reform) but gave it up due to Brexit";"";"unitedkingdom";627
"https://www.reddit.com/r/unitedkingdom/comments/hiilqo/jarvis_cocker_on_brexit_being_english_feels_a_bit/";"https://www.nme.com/news/music/jarvis-cocker-on-brexit-being-english-feels-a-bit-embarrassing-at-the-moment-2697924";2020-06-30;1593502278;"Jarvis Cocker on Brexit: Being English feels a bit embarrassing at the moment";"";"unitedkingdom";597
"https://www.reddit.com/r/unitedkingdom/comments/wust27/jeremy_corbyn_warned_that_brexit_would_lead_to/";"https://www.thelondoneconomic.com/politics/jeremy-corbyn-warned-that-brexit-would-lead-to-sewage-discharge-on-british-beaches-332640/?fbclid=IwAR1pJ5Xu48FU81Tswn7jgae1ZgEENA91nQMSgIFJbyDajaFNTgXRxc8XeTI";2022-08-22;1661172656;"Jeremy Corbyn warned that Brexit would lead to sewage discharge on British beaches";"";"unitedkingdom";660
"https://www.reddit.com/r/unitedkingdom/comments/cgr4ux/eu_shoots_down_boris_johnsons_brexit_plan_within/";"https://www.independent.co.uk/news/uk/politics/brexit-boris-johnson-eu-deal-tory-leadership-result-brussels-a9016911.html";2019-07-23;1563879572;"EU shoots down Boris Johnson's Brexit plan within moments of him becoming Tory leader";"";"unitedkingdom";460
"https://www.reddit.com/r/unitedkingdom/comments/b5od0h/brexit_political_will_of_the_people_must_be_in/";"https://www.independent.co.uk/news/uk/politics/brexit-will-of-people-poll-leave-remain-eu-second-referendum-vote-centre-social-research-curtice-a8839996.html";2019-03-26;1553598595;"Brexit: Political will of the people 'must be in question' as 55 per cent now want to stay in EU, poll finds";"";"unitedkingdom";446
"https://www.reddit.com/r/unitedkingdom/comments/do09sa/clocks_going_back_means_brexit_is_delayed_by/";"https://newsthump.com/2019/10/27/clocks-going-back-means-brexit-is-delayed-by-another-full-hour-moan-angry-brexiters/";2019-10-27;1572215830;"Clocks going back means Brexit is delayed by another full hour, moan angry Brexiters";"";"unitedkingdom";104
"https://www.reddit.com/r/unitedkingdom/comments/8unlfn/danny_dyer_on_brexit/";"https://streamable.com/5csxj";2018-06-28;1530221509;"Danny Dyer on Brexit.";"";"unitedkingdom";487
"https://www.reddit.com/r/unitedkingdom/comments/kc96y9/brexit_is_the_worst_decision_of_modern_times_why/";"https://www.theguardian.com/commentisfree/2020/dec/13/brexit-is-the-worst-decision-of-modern-times-why-are-its-critics-in-cabinet-so-silent?CMP=Share_AndroidApp_Other";2020-12-13;1607859452;"Brexit is the worst decision of modern times. Why are its critics in cabinet so silent? Michael Heseltine";"";"unitedkingdom";374
"https://www.reddit.com/r/unitedkingdom/comments/dj4i9y/the_new_brexitdeal_is_economically_worse_for/";"https://www.economist.com/leaders/2019/10/17/voters-should-get-a-say-on-any-deal-between-britain-and-the-eu";2019-10-17;1571308486;"The new BrexitDeal is economically worse for Britain than the one negotiated by Theresa May last year";"";"unitedkingdom";328
"https://www.reddit.com/r/unitedkingdom/comments/kwtvuf/fisheries_minister_did_not_read_brexit_bill_as/";"https://www.theguardian.com/politics/2021/jan/13/fisheries-minister-admits-not-reading-brexit-bill-as-she-was-at-nativity";2021-01-14;1610583494;"Fisheries minister did not read Brexit bill as she was busy at nativity";"";"unitedkingdom";220
"https://www.reddit.com/r/unitedkingdom/comments/a4juro/britains_youth_will_never_forgive_us_for_brexit/";"https://www.theguardian.com/politics/2018/dec/08/britains-youth-will-never-forgive-us-for-brexit-says-lord-heseltine";2018-12-09;1544349119;"Britain's youth will never forgive us for Brexit, says Lord Heseltine";"";"unitedkingdom";442
"https://www.reddit.com/r/unitedkingdom/comments/8ybrua/theresa_may_bows_to_eu_pressure_to_keep_uk_in/";"https://www.independent.co.uk/news/uk/politics/theresa-may-brexit-white-paper-eu-european-convention-on-human-rights-tory-mps-a8444386.html";2018-07-12;1531416206;"Theresa May bows to EU pressure to keep UK in human rights convention after Brexit, enraging Tory right";"";"unitedkingdom";323
"https://www.reddit.com/r/unitedkingdom/comments/m3dcxd/exports_to_eu_plunge_by_56bn_in_first_month_since/";"https://www.theguardian.com/business/2021/mar/12/exports-to-eu-plunge-in-first-month-since-brexit-uk-economy?CMP=Share_AndroidApp_Other";2021-03-12;1615537841;"Exports to EU plunge by £5.6bn in first month since Brexit";"";"unitedkingdom";454
"https://www.reddit.com/r/unitedkingdom/comments/do6hl8/bbc_news_eu_agrees_to_brexit_extension_to_31/";"https://www.bbc.co.uk/news/uk-politics-50205603";2019-10-28;1572255053;"BBC News: EU agrees to Brexit extension to 31 January";"";"unitedkingdom";1090
"https://www.reddit.com/r/unitedkingdom/comments/ucxue0/brexit_has_caused_uk_food_prices_to_rise_6_as/";"https://www.independent.co.uk/news/uk/politics/brexit-food-prices-living-costs-b2065985.html#l2h8xp1ey7sxaqynx8";2022-04-27;1651044005;"Brexit has caused UK food prices to rise 6% as cost of living crisis deepens, study says";"";"unitedkingdom";511
"https://www.reddit.com/r/unitedkingdom/comments/ij8bjq/47_of_brits_think_brexit_was_a_bad_idea_new_poll/";"https://www.thelondoneconomic.com/politics/47-of-brits-think-brexit-was-a-bad-idea-new-poll/26/08/";2020-08-30;1598769479;"47% of Brits think Brexit was a bad idea  new poll";"";"unitedkingdom";886
"https://www.reddit.com/r/unitedkingdom/comments/eoya2x/eu_confirms_there_will_be_border_checks_inside_uk/";"https://www.independent.co.uk/news/uk/politics/brexit-deal-border-check-boris-johnson-uk-eu-barnier-northern-ireland-goods-a9283686.html";2020-01-15;1579067435;"EU confirms there will be border checks inside UK under Brexit deal, contradicting Boris Johnsons false claim";"";"unitedkingdom";334
"https://www.reddit.com/r/unitedkingdom/comments/d197us/france_will_veto_another_brexit_delay_unless_uk/";"https://www.independent.co.uk/news/uk/politics/brexit-news-latest-article-50-delay-france-boris-johnson-extension-a9096361.html";2019-09-08;1567937930;"France will veto another Brexit delay unless UK ends political chaos";"";"unitedkingdom";735
"https://www.reddit.com/r/unitedkingdom/comments/ex21jt/brexit_the_most_pointless_masochistic_ambition_in/";"https://www.theguardian.com/politics/2020/feb/01/brexit-pointless-masochistic-ambition-history-done";2020-02-01;1580538431;"Brexit, the most pointless, masochistic ambition in our country's history, is done";"";"unitedkingdom";511
"https://www.reddit.com/r/unitedkingdom/comments/an178a/nicola_sturgeon_uk_is_not_remotely_prepared_to/";"https://www.thenational.scot/news/17406647.nicola-sturgeon-uk-is-not-remotely-prepared-to-leave-eu/";2019-02-04;1549283233;"Nicola Sturgeon: UK is 'not remotely prepared' to leave EU. With 53 days left until the UK is due to formally leave the EU, the Scottish First Minister will use a speech in the US to call again for a second Brexit referendum.";"";"unitedkingdom";440
"https://www.reddit.com/r/unitedkingdom/comments/prw2oo/poll_53_per_cent_of_uk_thinks_brexit_created_more/";"https://www.cityam.com/new-poll-53-per-cent-of-uk-thinks-brexit-deal-has-created-more-problems-than-it-solved/";2021-09-20;1632148295;"Poll: 53 per cent of UK thinks Brexit 'created more problems than it solved";"";"unitedkingdom";412
"https://www.reddit.com/r/unitedkingdom/comments/bmhn05/liberal_democrat_stop_brexit_manifesto_for_eu/";"https://www.libdems.org.uk/manifesto";2019-05-09;1557394556;"Liberal Democrat 'Stop Brexit' Manifesto for EU Elections";"";"unitedkingdom";595
"https://www.reddit.com/r/unitedkingdom/comments/czayc0/bbc_news_pm_loses_key_vote_on_brexit/";"https://www.bbc.co.uk/news/uk-politics-49573555";2019-09-03;1567545140;"BBC News: PM loses key vote on Brexit";"";"unitedkingdom";853
"https://www.reddit.com/r/unitedkingdom/comments/d1p6wm/boris_johnson_to_suspend_parliament_today_for/";"https://www.independent.co.uk/news/uk/politics/boris-johnson-news-parliament-prorogue-suspend-brexit-commons-latest-a9097401.html";2019-09-09;1568025827;"Boris Johnson to suspend Parliament today for more than a month despite Brexit crisis, Number 10 announces";"";"unitedkingdom";649
"https://www.reddit.com/r/unitedkingdom/comments/pmnn0f/just_3m_for_cornwall_rather_than_100m_before/";"https://www.falmouthpacket.co.uk/news/19571108.cornwall-get-just-3m-replacement-funding-leaving-eu/";2021-09-12;1631428531;"Just £3m for Cornwall rather than £100m before Brexit, despite Tory promises";"";"unitedkingdom";501
"https://www.reddit.com/r/unitedkingdom/comments/p3s2ht/brexit_has_brought_no_benefits_uk_manufacturers/";"https://www.thelondoneconomic.com/news/brexit-benefits-uk-manufacturers-285873/";2021-08-13;1628882356;"Brexit has brought no benefits, UK manufacturers say";"";"unitedkingdom";535
"https://www.reddit.com/r/unitedkingdom/comments/egahvv/nearly_1m_irish_passports_issued_in/";"https://www.independent.co.uk/news/uk/home-news/irish-passports-surge-in-applicants-after-brexit-simon-coveney-a9261031.html";2019-12-27;1577448922;"Nearly 1m Irish passports issued in record-breaking year, as Brits seek to keep EU citizenship after Brexit";"";"unitedkingdom";547
"https://www.reddit.com/r/unitedkingdom/comments/l00zcf/boris_johnson_blames_seafood_exporters_not/";"https://www.independent.co.uk/news/uk/politics/brexit-seafood-sales-boris-johnson-b1788936.html";2021-01-18;1610995953;"Boris Johnson blames seafood exporters not filling in the right forms for post-Brexit sales crash";"";"unitedkingdom";402
"https://www.reddit.com/r/unitedkingdom/comments/cqs8nz/tory_mp_breaks_rank_to_back_corbyn_as_caretaker/";"https://www.independent.co.uk/news/uk/politics/guto-bebb-corbyn-pm-government-block-no-deal-brexit-boris-a9061261.html";2019-08-15;1565886773;"Tory MP breaks rank to back Corbyn as caretaker PM to avoid no-deal Brexit";"";"unitedkingdom";641
"https://www.reddit.com/r/unitedkingdom/comments/dgasrh/brexit_party_meps_vote_against_plans_to_tackle/";"https://www.theguardian.com/world/2019/oct/10/brexit-party-meps-vote-against-measure-to-combat-russian-propaganda";2019-10-11;1570773402;"Brexit party MEPs vote against plans to tackle Russian propaganda";"";"unitedkingdom";159
"https://www.reddit.com/r/unitedkingdom/comments/ah7m5u/voters_want_to_remain_in_eu_by_12point_margin_as/";"https://www.independent.co.uk/news/uk/politics/brexit-poll-leave-remain-eu-vote-theresa-may-yougov-peoples-vote-referendum-a8733541.html";2019-01-18;1547792566;"Voters want to remain in EU by 12-point margin as Brexit opposition reaches new high, poll finds";"";"unitedkingdom";378
"https://www.reddit.com/r/unitedkingdom/comments/9phi9p/if_you_think_brexit_will_leave_us_weaker_and/";"https://www.theguardian.com/commentisfree/2018/oct/19/brexit-britain-weaker-poorer-peoples-vote?CMP=Share_iOSApp_Other";2018-10-19;1539933479;"If you think Brexit will leave us weaker and poorer, march for a peoples vote tomorrow";"";"unitedkingdom";580
"https://www.reddit.com/r/unitedkingdom/comments/dlzzw3/boris_johnson_cant_explain_why_workers_rights/";"https://www.mirror.co.uk/news/politics/boris-johnson-cant-explain-workers-20705784";2019-10-23;1571840451;"Boris Johnson can't explain why workers' rights have vanished from Brexit deal";"";"unitedkingdom";352
"https://www.reddit.com/r/unitedkingdom/comments/87zywp/hard_brexit_poll_suggests_northern_ireland_would/";"https://www.independent.co.uk/news/uk/home-news/northern-ireland-support-join-irish-republic-eu-hard-brexit-poll-lucidtalk-a8098531.html";2018-03-29;1522316560;"Hard Brexit poll suggests Northern Ireland would rather join Republic and stay in EU than remain in UK and leave";"";"unitedkingdom";552
"https://www.reddit.com/r/unitedkingdom/comments/z14jng/labour_must_make_sure_no_one_forgets_the_tories/";"https://www.newstatesman.com/comment/2022/11/tories-brexit-disaster-britain-labour";2022-11-21;1669051449;"Labour must make sure no one forgets the Tories Brexit disaster. More and more people are realising that Brexit is the greatest act of economic self-harm in living memory.";"";"unitedkingdom";434
"https://www.reddit.com/r/unitedkingdom/comments/awfj2v/giant_poster_goes_up_in_city_centre_mocking/";"https://www.walesonline.co.uk/news/uk-news/giant-poster-goes-up-city-15901255";2019-03-02;1551513919;"Giant poster goes up in city centre mocking Dyson's decision to move out of Britain after Brexit";"";"unitedkingdom";199
"https://www.reddit.com/r/unitedkingdom/comments/d3jw9e/boycott_of_probrexit_sun_newspaper_helped_cut/";"https://pressgazette.co.uk/sun-boycott-liverpool-cut-euroscepticism-brexit-in-merseyside-study-claims/";2019-09-13;1568348207;"Boycott of pro-Brexit Sun newspaper helped cut Euroscepticism in Merseyside, study claims";"";"unitedkingdom";179
"https://www.reddit.com/r/unitedkingdom/comments/66jagl/eu_would_welcome_uk_back_if_election_voters_veto/";"https://www.theguardian.com/politics/2017/apr/20/european-parliament-will-welcome-britain-back-if-voters-veto-brexit";2017-04-20;1492709854;"EU would welcome UK back if election voters veto Brexit - Brussels chief";"";"unitedkingdom";756
"https://www.reddit.com/r/unitedkingdom/comments/dfxm0a/nigel_farage_and_the_brexit_party_have_voted/";"https://www.theguardian.com/politics/live/2019/oct/10/brexit-latest-news-boris-johnson-varadkar-corbyn-no-deal-would-put-lives-at-risk-says-former-chief-medical-officer-live-news";2019-10-10;1570712125;"Nigel Farage and the Brexit party have voted against a European parliament resolution calling for stronger EU action to counter election meddling and Russian disinformation.";"";"unitedkingdom";141
"https://www.reddit.com/r/unitedkingdom/comments/b6aa2d/no_majority_for_any_of_brexit_options/";"https://www.bbc.co.uk/news/uk-politics-47728333";2019-03-27;1553723195;"No majority for any of Brexit options";"";"unitedkingdom";884
"https://www.reddit.com/r/unitedkingdom/comments/4pmxjq/royal_mint_has_unveiled_a_new_1_coin_design_to/";"https://c2.staticflickr.com/8/7005/6781676849_ac91b8f0c3_z.jpg";2016-06-24;1466775831;"Royal Mint has unveiled a new £1 coin design to celebrate Brexit";"";"unitedkingdom";224
"https://www.reddit.com/r/unitedkingdom/comments/ihodrn/germany_scraps_brexit_talks_due_to_lack_of/";"https://www.independent.co.uk/news/uk/politics/brexit-trade-deal-uk-talks-latest-germany-cancels-eu-summit-a9690911.html";2020-08-27;1598546256;"Germany scraps Brexit talks due to lack of progress in wasted summer - Boris Johnson under wrong impression that he can pull off negotiating at the 11th hour, says EU official";"";"unitedkingdom";436
"https://www.reddit.com/r/unitedkingdom/comments/a93fdx/corbyn_warned_he_risks_betraying_millions_of/";"https://www.heraldscotland.com/news/17317118.corbyn-warned-he-risks-betraying-millions-of-young-people-by-backing-brexit/";2018-12-24;1545641802;"Corbyn warned he risks 'betraying' millions of young people by backing Brexit";"";"unitedkingdom";659
"https://www.reddit.com/r/unitedkingdom/comments/i3dbc8/number_of_uk_citizens_emigrating_to_eu_has_risen/";"https://www.theguardian.com/politics/2020/aug/04/number-of-uk-citizens-emigrating-to-eu-has-risen-by-30-since-brexit-vote";2020-08-04;1596517909;"Number of UK citizens emigrating to EU has risen by 30% since Brexit vote";"";"unitedkingdom";520
"https://www.reddit.com/r/unitedkingdom/comments/9elqab/campaign_to_prosecute_boris_johnson_over_350m/";"https://www.independent.co.uk/news/uk/politics/brexit-boris-johnson-nhs-bus-claim-350-million-fundraiser-campaign-prosecute-a8528886.html";2018-09-10;1536574211;"Campaign to prosecute Boris Johnson over £350m Brexit bus claim raises £24,000 in two days";"";"unitedkingdom";187
"https://www.reddit.com/r/unitedkingdom/comments/68khxv/forbes_the_uk_government_is_completely_deluded/";"https://www.forbes.com/sites/francescoppola/2017/04/30/the-uk-government-is-completely-deluded-about-brexit/";2017-05-01;1493621100;"Forbes - ""The UK Government Is Completely Deluded About Brexit""";"";"unitedkingdom";477
"https://www.reddit.com/r/unitedkingdom/comments/axihje/may_did_not_understand_eu_when_she_triggered/";"https://www.theguardian.com/politics/2019/mar/04/theresa-may-did-not-understand-eu-when-she-triggered-brexit";2019-03-05;1551771318;"May 'did not understand EU when she triggered Brexit'";"";"unitedkingdom";425
"https://www.reddit.com/r/unitedkingdom/comments/a2e1cl/brexit_advent_calendar_goes_on_sale_with_fuck_all/";"https://uokhun.uk/2018/12/02/brexit-advent-calendar-goes-on-sale-with-fuck-all-behind-each-door/";2018-12-02;1543764208;"Brexit advent calendar goes on sale with fuck all behind each door";"";"unitedkingdom";99
"https://www.reddit.com/r/unitedkingdom/comments/92d1om/brexit_has_already_cost_the_uk_more_than_its_eu/";"https://www.bloomberg.com/news/articles/2018-06-22/u-k-brexit-hit-already-exceeds-eu-budget-payments-study-shows";2018-07-27;1532702190;"Brexit Has Already Cost the U.K. More than Its EU Budget Payments, Study Shows";"";"unitedkingdom";350
"https://www.reddit.com/r/unitedkingdom/comments/9pwf2m/protesters_flood_streets_of_london_as_over_500000/";"https://www.joe.co.uk/news/peoples-vote-brexit-protest-eu-204947";2018-10-20;1540059683;"Protesters flood streets of London as over 500,000 call for People's Vote on Brexit";"";"unitedkingdom";709
"https://www.reddit.com/r/unitedkingdom/comments/9xd07a/majority_of_brits_now_against_brexit_and_back/";"https://news.sky.com/story/majority-of-brits-now-against-brexit-and-back-second-eu-referendum-sky-data-poll-11555078";2018-11-15;1542301408;"Majority of Brits now against Brexit and back second EU referendum - Sky Data poll";"";"unitedkingdom";374
"https://www.reddit.com/r/unitedkingdom/comments/qb7gm0/daily_mail_buries_poll_showing_voters_have_turned/";"https://www.thelondoneconomic.com/news/daily-mail-buries-poll-showing-voters-have-turned-against-brexit-295935/";2021-10-19;1634633704;"Daily Mail buries poll showing voters have turned against Brexit";"";"unitedkingdom";411
"https://www.reddit.com/r/unitedkingdom/comments/9g49n8/give_britain_a_new_referendum_on_brexit_says/";"https://www.theguardian.com/politics/2018/sep/15/sadiq-khan-new-referendum-peoples-vote-labour-corbyn";2018-09-15;1537040060;"Give Britain a new referendum on Brexit, says Sadiq Khan | Politics";"";"unitedkingdom";500
"https://www.reddit.com/r/unitedkingdom/comments/7j10m1/exclusive_two_thirds_of_young_people_want_to_stop/";"https://leftfootforward.org/2017/12/exclusive-two-thirds-of-young-people-want-to-stop-brexit/";2017-12-11;1512982089;"Exclusive: two thirds of young people want to stop Brexit";"";"unitedkingdom";583
"https://www.reddit.com/r/unitedkingdom/comments/ancr2p/brexiters_excitedly_repeating_we_survived_the/";"https://newsthump.com/2019/02/04/brexiters-excitedly-repeating-we-survived-the-blitz-reminded-that-many-people-didnt/";2019-02-05;1549361604;"Brexiters excitedly repeating we survived The Blitz reminded that many people didnt";"";"unitedkingdom";203
